{
  "file_characteristics":{
    "author": "${author}",
    "license": "${license}",
    "contact": "${contact}",
    "creation_time": "${creation_time}"
  },
  "characteristics":{
    "mesh_type": "SQUARE_TILE",
    "landscape_uom_system": "${landscape_uom_system}",
    "tile_size_uom": "${tile_size_uom}",
    "tile_width": 1,
    "tile_height": 1,
    "tile_depth": 1
  },
  "physicality":{
    "gravity_uom":"METERS_PER_SECOND_SQUARED",
    "gravity_strength": 9.8
  },
  "custom_attributes":{
    "ignore":123
  },
  "tiles": [
    [0, 0, 0, 3],[1, 0, 0, 3],[2, 0, 0, 3],[3, 0, 0, 3],[4, 0, 0, 3],[5, 0, 0, 3],[6, 0, 0, 3],[7, 0, 0, 3],[8, 0, 0, 3],[9, 0, 0, 3],
    [0, 0, 1, 3],[1, 0, 1, 3],[2, 0, 1, 3],[3, 0, 1, 3],[4, 0, 1, 3],[5, 0, 1, 3],[6, 0, 1, 3],[7, 0, 1, 3],[8, 0, 1, 3],[9, 0, 1, 3],
    [0, 0, 2, 3],[1, 0, 2, 3],[2, 0, 2, 3],[3, 0, 2, 3],[4, 0, 2, 3],[5, 0, 2, 3],[6, 0, 2, 3],[7, 0, 2, 3],[8, 0, 2, 3],[9, 0, 2, 3],
    [0, 0, 3, 3],[1, 0, 3, 3],[2, 0, 3, 3],[3, 0, 3, 3],[4, 0, 3, 3],[5, 0, 3, 3],[6, 0, 3, 3],[7, 0, 3, 3],[8, 0, 3, 3],[9, 0, 3, 3],
    [0, 0, 4, 3],[1, 0, 4, 3],[2, 0, 4, 3],[3, 0, 4, 3],[4, 0, 4, 3],[5, 0, 4, 3],[6, 0, 4, 3],[7, 0, 4, 3],[8, 0, 4, 3],[9, 0, 4, 3],
    [0, 0, 5, 3],[1, 0, 5, 3],[2, 0, 5, 3],[3, 0, 5, 3],[4, 0, 5, 3],[5, 0, 5, 3],[6, 0, 5, 3],[7, 0, 5, 3],[8, 0, 5, 3],[9, 0, 5, 3],
    [0, 0, 6, 3],[1, 0, 6, 3],[2, 0, 6, 3],[3, 0, 6, 3],[4, 0, 6, 3],[5, 0, 6, 3],[6, 0, 6, 3],[7, 0, 6, 3],[8, 0, 6, 3],[9, 0, 6, 3],
    [0, 0, 7, 3],[1, 0, 7, 3],[2, 0, 7, 3],[3, 0, 7, 3],[4, 0, 7, 3],[5, 0, 7, 3],[6, 0, 7, 3],[7, 0, 7, 3],[8, 0, 7, 3],[9, 0, 7, 3],
    [0, 0, 8, 3],[1, 0, 8, 3],[2, 0, 8, 3],[3, 0, 8, 3],[4, 0, 8, 3],[5, 0, 8, 3],[6, 0, 8, 3],[7, 0, 8, 3],[8, 0, 8, 3],[9, 0, 8, 3],
    [0, 0, 9, 3],[1, 0, 9, 3],[2, 0, 9, 3],[3, 0, 9, 3],[4, 0, 9, 3],[5, 0, 9, 3],[6, 0, 9, 3],[7, 0, 9, 3],[8, 0, 9, 3],[9, 0, 9, 3]
  ]
}